{
  "schema_version": "1",
  "intent": "seat_party_together",
  "summary": "Automatic family seat selection. Finds seats together for a travelling party and moves everyone in one step.",
  "observation": {
    "inputs": [
      {
        "name": "flight_id",
        "type": "string",
        "description": "The flight the reservation is on, e.g. NA214."
      },
      {
        "name": "reservation_code",
        "type": "string",
        "description": "The confirmation code of the party's reservation."
      },
      {
        "name": "passengers",
        "type": "string[]",
        "description": "Passenger ids of the party to seat together, in the reservation's order."
      }
    ],
    "app_state": [
      {
        "name": "seat_map",
        "type": "object",
        "description": "Every row and seat with its live state: available, booked, blocked or occupied by this party."
      },
      {
        "name": "available_seats",
        "type": "string[]",
        "description": "Seat ids a passenger could take right now."
      },
      {
        "name": "restrictions",
        "type": "object[]",
        "description": "Per passenger: type, age, whether an exit row is allowed, whether they must sit with an adult."
      },
      {
        "name": "seat_prices",
        "type": "object",
        "description": "Price in cents per seat id; zero for a standard seat."
      }
    ],
    "interactive_elements": [
      {
        "type": "seat",
        "id": {
          "name": "seat_id",
          "type": "string",
          "description": "Row and column, e.g. 21A."
        },
        "attributes": [
          {
            "name": "row",
            "type": "integer",
            "range": {
              "min": 1,
              "max": 30
            }
          },
          {
            "name": "column",
            "type": "string",
            "enum": [
              "A",
              "B",
              "C",
              "D",
              "E",
              "F"
            ]
          },
          {
            "name": "state",
            "type": "string",
            "enum": [
              "available",
              "booked",
              "blocked",
              "occupied"
            ]
          },
          {
            "name": "is_exit_row",
            "type": "boolean"
          },
          {
            "name": "price_cents",
            "type": "integer",
            "range": {
              "min": 0
            }
          }
        ],
        "constraints": [
          "blocked seats are never assigned",
          "exit rows are adults only",
          "the aisle sits between C and D"
        ],
        "available_actions": [
          "assign_seat",
          "calculate_seat_price"
        ]
      }
    ],
    "example": {
      "party_size": 3,
      "current_seats": [
        "12A",
        "18C",
        "24F"
      ],
      "available_seats": [
        "21A",
        "21B",
        "21C"
      ]
    }
  },
  "actions": [
    {
      "name": "get_seat_map",
      "kind": "read",
      "description": "Read the whole cabin with the state of every seat.",
      "returns": "SeatMap",
      "primitive": {
        "symbol": "getSeatMap",
        "file": "lib/seats/index.ts",
        "confidence": 0.96
      },
      "idempotent": true,
      "params": [
        {
          "name": "flight_id",
          "type": "string"
        }
      ],
      "action_type": "invoke_function"
    },
    {
      "name": "get_available_seats",
      "kind": "read",
      "description": "The ids of every seat a passenger could take right now.",
      "returns": "string[]",
      "primitive": {
        "symbol": "getAvailableSeats",
        "file": "lib/seats/index.ts",
        "confidence": 0.97
      },
      "idempotent": true,
      "params": [
        {
          "name": "flight_id",
          "type": "string"
        }
      ],
      "action_type": "invoke_function"
    },
    {
      "name": "get_passenger_restrictions",
      "kind": "read",
      "description": "What one passenger may and may not do: exit rows, sitting apart from an adult.",
      "returns": "PassengerRestrictions",
      "primitive": {
        "symbol": "getPassengerRestrictions",
        "file": "lib/seats/index.ts",
        "confidence": 0.95
      },
      "idempotent": true,
      "params": [
        {
          "name": "passenger_id",
          "type": "string"
        }
      ],
      "action_type": "invoke_function"
    },
    {
      "name": "calculate_seat_price",
      "kind": "read",
      "description": "What one seat costs, in cents.",
      "returns": "number",
      "primitive": {
        "symbol": "calculateSeatPrice",
        "file": "lib/seats/index.ts",
        "confidence": 0.95
      },
      "idempotent": true,
      "params": [
        {
          "name": "flight_id",
          "type": "string"
        },
        {
          "name": "seat_id",
          "type": "string"
        }
      ],
      "action_type": "invoke_function"
    },
    {
      "name": "rank_seat_groups",
      "kind": "rank",
      "description": "Order every valid group of adjacent seats by the preferences: lowest added cost first, children beside an adult.",
      "returns": "SeatGroup[]",
      "params": [
        {
          "name": "groups",
          "type": "object[]"
        },
        {
          "name": "passengers",
          "type": "object[]"
        }
      ],
      "action_type": "invoke_function"
    },
    {
      "name": "assign_seat",
      "kind": "write",
      "description": "Move one passenger to one seat. Atomic and idempotent; there is no bulk form.",
      "returns": "AssignSeatResult",
      "primitive": {
        "symbol": "assignSeat",
        "file": "lib/seats/index.ts",
        "confidence": 0.97
      },
      "idempotent": true,
      "params": [
        {
          "name": "passenger_id",
          "type": "string"
        },
        {
          "name": "seat_id",
          "type": "string"
        }
      ],
      "action_type": "invoke_function"
    }
  ],
  "constraints": [
    {
      "id": "same_row",
      "statement": "Every seat in the group is in the same row.",
      "source": "trajectory"
    },
    {
      "id": "contiguous",
      "statement": "The seats are contiguous, with no empty seat and no other passenger between them.",
      "source": "trajectory"
    },
    {
      "id": "aisle_is_a_boundary",
      "statement": "Seats on opposite sides of the aisle are not adjacent. A group never spans the aisle.",
      "source": "repository"
    },
    {
      "id": "available_only",
      "statement": "Only seats that are available at the time of the call are used. A seat the party already holds counts as available to the party.",
      "source": "repository"
    },
    {
      "id": "blocked_seats_excluded",
      "statement": "A seat held out of service for accessible seating is never used.",
      "source": "policy"
    },
    {
      "id": "respect_passenger_restrictions",
      "statement": "A child is never placed in an exit row. A passenger who must sit with an adult is placed next to one.",
      "source": "policy"
    },
    {
      "id": "no_partial_moves",
      "statement": "Applying a result moves every passenger or none. If one move fails, the passengers that were already moved return to their previous seats.",
      "source": "inferred"
    },
    {
      "id": "party_only",
      "statement": "Only passengers of the given reservation can be moved. Anyone else is refused.",
      "source": "policy"
    }
  ],
  "preferences": [
    {
      "id": "minimize_additional_cost",
      "statement": "Prefer the group with the lowest added cost over the party's current seats.",
      "direction": "minimize",
      "weight": 0.7
    },
    {
      "id": "keep_children_adjacent_to_parent",
      "statement": "Prefer groups where each child sits directly beside an adult of the party.",
      "direction": "maximize",
      "weight": 0.9
    },
    {
      "id": "keep_current_seats_when_together",
      "statement": "Prefer the party's current seats when they already satisfy every constraint.",
      "direction": "maximize",
      "weight": 0.5
    }
  ],
  "success": {
    "final_state": [
      {
        "id": "all_passengers_adjacent",
        "statement": "After applying the result, every passenger of the party sits in one contiguous group in one row, on one side of the aisle."
      },
      {
        "id": "no_constraint_violated",
        "statement": "The applied seats satisfy every constraint at the moment of applying them."
      },
      {
        "id": "cost_reported",
        "statement": "The result states the added cost in cents before anything is applied."
      }
    ],
    "scenarios": [
      {
        "id": "three_contiguous_available",
        "kind": "happy",
        "given": "a party of one adult and two children in 12A, 18C and 24F, and row 21 A, B and C available",
        "when": "the party asks for seats together",
        "then": "the result is 21A, 21B and 21C with an added cost of 0"
      },
      {
        "id": "aisle_separated_not_adjacent",
        "kind": "edge",
        "given": "a row where only C and D are available, on opposite sides of the aisle, and a party of two",
        "when": "the party asks for seats together",
        "then": "that row is not offered as a group"
      },
      {
        "id": "no_three_seat_group",
        "kind": "edge",
        "given": "no row with three contiguous available seats on one side",
        "when": "a party of three asks for seats together",
        "then": "the result says no group is available and every passenger keeps their seat"
      },
      {
        "id": "blocked_accessibility_seat_excluded",
        "kind": "adversarial",
        "given": "the only three-seat run in a row includes the blocked accessible seat",
        "when": "a party of three asks for seats together",